id;sentence;mean_word_length;mean_syllables;max_syllables;lexical_density;tokens;max_dependency_distance;fin_verbs;mean_band_subtlex;mean_complexity
454;Entscheidend für das Fortbestehen eines Gletschers ist seine Massenbilanz, die Differenz von Akkumulation (wie Schneefall, Ablagerung von Triebschnee und Lawinen, Kondensation von atmosphärischem Wasserdampf und Anfrieren von Regenwasser) und Ablation (Schmelze, Sublimation sowie Abbruch von Lawinen).;7,16666666666667;2,44444444444444;6;0,5555555555555556;36;44;1;17,95000000000000;5,000000000
455;Jeder Gletscher besteht dabei aus einem Nähr- und einem Zehrgebiet.;5,70000000000000;1,80000000000000;3;0,4000000000000000;10;8;1;16,50000000000000;3,428571429
456;Im Nährgebiet (Akkumulationsgebiet) bleibt zumindest ein Teil des Schnees auch während des Sommers erhalten und formt sich dann zu Gletschereis um.;5,90476190476191;1,80952380952381;8;0,4285714285714285;21;18;2;14,33333333333333;2,375000000
457;Im Zehrgebiet (Ablationsgebiet) dagegen überwiegt die Ablation gegenüber dem Nachschub durch Schnee.;7,16666666666667;2,33333333333333;6;0,5000000000000000;12;8;1;16,83333333333333;3,307692308
458;Getrennt sind diese beiden Gebiete durch die Gleichgewichtslinie.;7,12500000000000;2,12500000000000;5;0,3750000000000000;8;8;1;14,66666666666667;2,700000000
459;Entlang dieser Linie entspricht die Ablation im Sommer der Akkumulation im Winter.;5,83333333333333;2,16666666666667;6;0,5000000000000000;12;11;1;14,00000000000000;2,538461538
460;Bei einem Klimawandel können sich sowohl Lufttemperaturen als auch der Niederschlag in Form von Schnee verändern und damit die Massenbilanz verschieben.;6,23809523809524;2,00000000000000;6;0,3809523809523810;21;16;1;14,62500000000000;3,363636364
461;In den meisten Regionen der Welt steigen die Temperaturen hauptsächlich infolge des menschlichen Ausstoßes von Treibhausgasen an.;6,58823529411765;2,11764705882353;5;0,4117647058823529;17;11;1;13,71428571428571;2,000000000
462;Nach dem 2007 erschienenen Vierten Sachstandsbericht der Zwischenstaatlichen Sachverständigengruppe über Klimaänderungen (IPCC) stieg die weltweite durchschnittliche Lufttemperatur in Bodennähe zwischen 1906 und 2005 um 0,74 °C (± 0,18 °C) an.;6,74193548387097;2,16129032258065;7;0,4516129032258064;31;21;1;17,50000000000000;4,900000000
463;Die Erwärmung ist mit zunehmender Nähe zu den Polen (siehe Polare Verstärkung) und mit steigender Höhe in Gebirgen (man spricht vom elevation dependent warming, dt höhenabhängige Erwärmung) stärker ausgeprägt.;6,03448275862069;2,13793103448276;6;0,5172413793103449;29;33;2;14,13333333333333;3,600000000
464;Im Gegensatz zur Lufttemperatur existieren für den Niederschlag keine eindeutigen Trends.;7,09090909090909;2,27272727272727;5;0,5454545454545454;11;7;1;15,00000000000000;2,000000000
466;Rückgänge von bis zu 50 % wurden besonders in West- und Ostafrika und im Westen Lateinamerikas gemessen.;5,11764705882353;1,82352941176471;5;0,2352941176470588;17;18;1;14,66666666666667;2,000000000
467;Deshalb ist für jede der betroffenen Regionen gesondert zu prüfen, welche Faktoren für den Rückgang der Gletscher ursächlich und gegebenenfalls dominierend sind.;6,27272727272727;2,09090909090909;5;0,4090909090909091;22;14;2;16,22222222222222;3,800000000
468;Kryokonit ist ein dunkler biogener Oberflächenstaub auf Schnee und Eis, der durch Winde in der Atmosphäre über weite Strecken transportiert wird und gewöhnlich auf Gletschern weltweit zu beobachten ist.;5,93103448275862;1,79310344827586;4;0,4827586206896552;29;25;3;13,42857142857143;4,600000000
469;Wegen seiner dunklen Färbung reduziert Kryokonit wesentlich die Oberflächenreflexion des Sonnenlichts und beschleunigt oder initiiert damit das Schmelzen der Gletscher.;7,40000000000000;2,25000000000000;7;0,5000000000000000;20;16;2;14,80000000000000;4,000000000
470;Obwohl Kryokonit aus Mineralpartikeln (Ruß, Kohlenstoff und Stickstoff) und organischer Materie besteht, ist der organische Anteil bezüglich der Wirkung auf das Abschmelzen bedeutender, weil er häufig biologisch aktiv ist und den Hauptteil von Kryokonit ausmacht.;6,37142857142857;2,05714285714286;6;0,4857142857142857;35;27;4;14,52941176470588;4,800000000
471;Dieses organische Material besteht zum Teil aus photosynthetisch aktiven Mikroorganismen wie Cyanobakterien oder auch Bärtierchen, wie es am Rotmoosferner nachgewiesen wurde.;7,23809523809524;2,57142857142857;6;0,5238095238095238;21;21;2;15,81818181818182;4,000000000
472;Zumindest in den Alpen wird beim Auftreten von Kryokonit der ebenfalls dunkel gefärbte Gletscherfloh beobachtet, der sich von dem eingetragenen biologischen Material ernährt, so dass eine wachsende, dunkel gefärbte Flora und Fauna im Gletscher entsteht, die in dem Schmelzwasser lebt und sich vermehrt.;5,93023255813953;1,93023255813953;5;0,4883720930232558;43;34;4;14,38095238095238;5,000000000
473;Auf eine Abkühlung oder eine Verstärkung des Schneefalls, die eine positive Massenbilanz hervorrufen, reagiert ein Gletscher mit Wachstum.;6,55555555555556;2,11111111111111;4;0,5000000000000000;18;16;2;14,88888888888889;2,333333333
474;Dadurch nimmt die Gletscherfläche im Zehrgebiet, dort ist die Ablation am höchsten, zu.;5,53846153846154;1,76923076923077;4;0,3846153846153846;13;16;2;16,20000000000000;4,000000000
475;Somit erlangt der Gletscher ein neues Gleichgewicht.;6,42857142857143;1,85714285714286;3;0,5714285714285714;7;6;1;12,50000000000000;2,000000000
476;Derzeit gibt es ein paar Gletscher, die wachsen.;4,87500000000000;1,37500000000000;2;0,3750000000000000;8;8;2;10,66666666666667;1,800000000
478;Auf eine Klimaerwärmung wie die globale Erwärmung oder eine Abnahme des Schneefalls, die zu einer negativen Massenbilanz führen, reagiert der Gletscher mit einem Rückgang.;6,04166666666667;2,04166666666667;5;0,4583333333333333;24;21;2;15,45454545454546;3,777777778
479;Dadurch verliert der Gletscher Teile seines meistens tiefer gelegenen Ablationsgebiets, sodass Akkumulation und Ablation wieder ausgeglichen sind.;7,52941176470588;2,64705882352941;6;0,5294117647058824;17;17;2;15,11111111111111;3,444444444
480;Wenn sich ein Gletscher jedoch nicht zu einem neuen Gleichgewichtspunkt zurückziehen kann, befindet er sich im andauernden Ungleichgewicht und wird, sofern dieses Klima bestehen bleibt, komplett abschmelzen.;6,55555555555556;1,96296296296296;4;0,4444444444444444;27;18;4;13,25000000000000;5,222222222
481;Die Klimageschichte dokumentiert Entwicklung, Schwankungen und Auswirkungen des irdischen Klimas sowohl in geologischen Zeiträumen als auch in den Epochen der jüngeren Vergangenheit.;7,22727272727273;2,31818181818182;5;0,5454545454545454;22;21;1;15,33333333333333;3,800000000
482;Je nach zeitlicher Perspektive werden dabei Klimaverläufe über wenige Jahrzehnte bis hin zu einigen Hundert Millionen Jahren analysiert.;6,55555555555556;2,27777777777778;5;0,3888888888888889;18;18;1;13,28571428571429;2,222222222
483;Die Wissenschaften zur Erforschung des Klimas sind die Paläoklimatologie und die Historische Klimatologie.;7,15384615384615;2,46153846153846;7;0,4615384615384616;13;10;1;17,00000000000000;2,714285714
484;Letztere verzeichnet auch die verschiedenen Wetteranomalien in historischer Zeit, die unter anderem von heftigen vulkanischen Eruptionen hervorgerufen wurden.;7,72222222222222;2,72222222222222;7;0,5000000000000000;18;18;2;14,55555555555556;2,800000000
485;Zuverlässige und instrumentell ermittelte Temperatur- und Klimadaten stehen auf breiterer Basis erst seit der zweiten Hälfte des 19 Jahrhunderts zur Verfügung.;6,52380952380952;2,23809523809524;5;0,5714285714285714;21;15;1;13,72727272727273;3,700000000
486;Informationen über frühere Zeiträume galten lange als relativ unsicher, können jedoch zunehmend besser und genauer belegt werden.;6,52941176470588;2,35294117647059;5;0,5882352941176471;17;14;2;12,30000000000000;2,142857143
488;Zusätzlich kommt in der Forschung ein breites Spektrum verschiedener Isotopenanalysen zum Einsatz, deren jüngste Entwicklungen eine bis vor kurzem unerreichbare Messgenauigkeit ermöglichen.;7,54545454545455;2,45454545454545;6;0,6363636363636364;22;23;2;13,92857142857143;4,600000000
489;Die Klimageschichte ist auch für die Evolutionsgeschichte von Bedeutung.;7,00000000000000;2,33333333333333;7;0,3333333333333333;9;9;1;16,66666666666667;1,700000000
490;Zur Rekonstruktion vergangener Klimazustände gibt es eine Reihe verschiedener Untersuchungsmethoden.;9,00000000000000;3,20000000000000;7;0,7000000000000000;10;6;1;14,42857142857143;2,000000000
491;Bereits im 19 Jahrhundert wurde anhand von geologischen Klimazeugen wie Trogtälern, Grundmoränen oder Gletscherschliffen eine lange währende Eiszeit mit großräumigen Vergletscherungen (damals oft „Weltwinter“ genannt) sowohl in Europa als auch auf anderen Kontinenten direkt nachgewiesen.;7,08571428571429;2,34285714285714;5;0,4571428571428571;35;41;1;15,81250000000000;4,800000000
492;Weitere Klimaarchive, mit denen frühere Warmzeiten belegt werden können, sind zum Beispiel Lage und Ausdehnung urzeitlicher Korallenriffe oder die Analyse bestimmter Sedimente und Sedimentgesteine, die unter tropischen Bedingungen entstanden sind.;7,13333333333333;2,46666666666667;6;0,5666666666666667;30;19;3;15,11764705882353;4,571428571
493;Während die Historische Klimatologie vielfach auf schriftliche Aufzeichnungen, historische Chroniken oder archäologische Artefakte zurückgreift, verwendet die Paläoklimatologie klassische Nachweisverfahren wie die Dendrochronologie (Baumringanalyse), die Palynologie (Pollenuntersuchungen), Tropfsteine sowie die Warvenchronologie (auch Bändertondatierung genannt), die sich auf die Auswertung von Ablagerungen in Still- und Fließgewässern stützt.;8,66666666666667;2,86666666666667;7;0,5777777777777777;45;41;3;17,00000000000000;5,555555556
498;Allerdings deckt die 14C-Methode nur einen relativ schmalen zeitlichen Bereich von 300 bis maximal 57000 Jahren ab.;5,38888888888889;1,77777777777778;3;0,4444444444444444;18;18;1;13,12500000000000;3,625000000
499;Einen Zeitrahmen von mehreren Hundert Millionen Jahren umfasst hingegen die Temperaturbestimmung mithilfe der Sauerstoff-Isotope 18O/16O, für die sich besonders fossile Korallen, Foraminiferen und Süßwassersedimente eignen.;7,50000000000000;2,61538461538462;7;0,4615384615384616;26;22;2;15,25000000000000;4,000000000
500;Für geologische und paläoklimatologische Untersuchungen bietet sich darüber hinaus eine Reihe von Beryllium-, Eisen-, Chrom- und Edelgas-Isotopen an.;6,40000000000000;2,25000000000000;8;0,5500000000000000;20;18;1;17,18181818181818;2,000000000
501;In letzter Zeit kommt die 40Ar/39Ar-Datierung verstärkt zum Einsatz, da diese Methode auf der Grundlage des Edelgases Argon erheblich präzisere Ergebnisse als die herkömmliche Kalium-Argon-Datierung ermöglicht.;6,24137931034483;2,06896551724138;4;0,5862068965517241;29;30;3;13,64705882352941;3,500000000
502;Ebenfalls sehr genaue geochronologische Daten liefern Zirkonkristalle aufgrund der darin enthaltenen Spuren radioaktiver Nuklide.;8,21428571428571;2,78571428571429;6;0,6428571428571429;14;9;1;15,44444444444444;4,100000000
503;Die Klimageschichte beginnt mit der Entstehung der Erde vor etwa 4,6 Milliarden Jahren.;5,69230769230769;2,00000000000000;5;0,4615384615384616;13;11;1;11,50000000000000;2,000000000
505;Die Abkühlung dauerte sehr lange, vor 4 Milliarden Jahren unterschritt die Temperatur das erste Mal die 100-°C-Grenze.;5,55555555555556;1,88888888888889;4;0,6111111111111112;18;17;2;11,45454545454546;2,000000000
506;Das Klima in dieser Zeit war daher nicht nur heiß, sondern auch sehr trocken.;4,42857142857143;1,35714285714286;2;0,2857142857142857;14;10;1;9,50000000000000;1,000000000
507;So gab es noch keine Meere, Niederschläge oder sonstiges flüssiges Wasser auf der Erde, und die Zusammensetzung der reduzierenden Uratmosphäre unterschied sich stark von der heutigen Erdatmosphäre.;6,22222222222222;2,14814814814815;5;0,5185185185185185;27;28;2;13,28571428571429;4,200000000
508;Ungeachtet der Umweltverhältnisse kam zu diesem Zeitpunkt die Chemische Evolution in Gang, bei der sich organische Moleküle bildeten, die als Bausteine der Entstehung von Leben unerlässlich waren.;6,18518518518519;2,18518518518519;6;0,4814814814814815;27;26;3;13,07692307692308;4,300000000
509;Mit der fortschreitenden Abkühlung erreichte der Wasserdampf zum ersten Mal in der Geschichte der Erde seinen Kondensationspunkt, so dass sich flüssiges Wasser bilden konnte.;6,20833333333333;2,00000000000000;6;0,4583333333333333;24;22;2;12,72727272727273;3,166666667
510;Ohne dieses wäre die Entstehung von Leben und die nachfolgende Biologische Evolution auf der Erde unmöglich gewesen.;5,82352941176471;2,17647058823529;4;0,4117647058823529;17;16;1;11,28571428571429;2,600000000
511;Nachdem das erste Wasser kondensiert war, entstand allmählich der Wasserkreislauf und damit die Hydrosphäre.;6,64285714285714;2,07142857142857;4;0,5000000000000000;14;8;2;14,00000000000000;2,700000000
512;Die ältesten Anzeichen für Ozeane auf unserer Erde sind in Gesteinen vorhanden, die inzwischen ein Alter von 3,2 Milliarden Jahren erreicht haben.;5,59090909090909;1,95454545454545;4;0,4545454545454546;22;12;2;11,60000000000000;3,200000000
513;Vor 2,6 Milliarden Jahren bildete sich im Laufe der Entwicklung der Erdatmosphäre durch die Aktivität von Cyanobakterien der erste Sauerstoff in der Uratmosphäre und erreichte vor circa 2,2 Milliarden Jahren signifikante Konzentrationen.;6,40625000000000;2,34375000000000;6;0,5000000000000000;32;29;2;13,00000000000000;3,222222222
514;Der Wasserdampf kondensierte größtenteils und wurde als Wasser in Meeren und Seen gebunden.;6,00000000000000;2,00000000000000;4;0,4615384615384616;13;11;2;14,50000000000000;3,333333333
515;Mit dem Wasserdampf verschwand auch ein großer Teil des Kohlendioxids aus der Atmosphäre.;5,84615384615385;1,76923076923077;4;0,4615384615384616;13;10;1;12,83333333333333;3,000000000
517;Der Kohlenstoff wurde dem normalen Kreislauf entzogen, weil die Cyanobakterien nicht von anderen Organismen verstoffwechselt wurden, sondern sich am Meeresboden absetzten, wo sie fein verteilt in den Sedimenten ablagerten oder im küstennahen, lichtdurchfluteten Flachwasserbereich als Stromatolithe fossilisierten.;7,37837837837838;2,43243243243243;6;0,5135135135135135;37;37;5;16,26315789473684;6,000000000
518;Erst dadurch war der Aufbau einer oxidierenden Sauerstoffatmosphäre möglich, wobei über einen langen Zeitraum keine wesentlichen Konzentrationssteigerungen auftraten, da der freigesetzte Sauerstoff zunächst nur Eisenverbindungen oxidierte.;8,11538461538461;2,69230769230769;9;0,5000000000000000;26;20;3;15,53846153846154;4,000000000
519;Dieses Eisenoxid resultierte in großen Ablagerungen so genannter Bändererze, die als ergiebige Lagerstätten erhalten blieben und intensiv abgebaut werden.;7,05263157894737;2,57894736842105;5;0,6315789473684210;19;18;3;15,75000000000000;5,166666667
520;Die Sauerstoffkonzentration in der Atmosphäre stieg weiter an, so dass damit aerobes Leben auf der Erde möglich wurde.;5,50000000000000;2,00000000000000;8;0,3888888888888889;18;14;2;12,14285714285714;2,000000000
521;Die Veränderung der Konzentration der Klimagase und ihrer Zusammensetzung veränderte zudem den Strahlungshaushalt der Erde und brachte den Treibhauseffekt in Gang, der die Erde seitdem erwärmt.;6,38461538461539;2,15384615384615;5;0,4230769230769231;26;18;3;12,54545454545454;2,875000000
522;Erdwärme ist die im zugänglichen Teil der Erdkruste gespeicherte Wärme (thermische Energie).;6,50000000000000;2,25000000000000;4;0,6666666666666666;12;11;1;15,25000000000000;3,071428571
523;Sie umfasst die in der Erde gespeicherte Energie, soweit sie entzogen und genutzt werden kann, und zählt zu den regenerativen Energien.;5,33333333333333;1,95238095238095;6;0,4285714285714285;21;22;3;13,55555555555556;3,400000000
524;Sie kann sowohl direkt genutzt werden, etwa zum Heizen und Kühlen im Wärmemarkt (Wärmepumpenheizung), als auch zur Erzeugung von elektrischem Strom oder in einer Kraft-Wärme-Kopplung.;5,62962962962963;1,77777777777778;6;0,4444444444444444;27;32;1;14,91666666666667;4,571428571
526;Die bei ihrer Entstehung glutflüssige Erde ist innerhalb weniger Millionen Jahre erstarrt.;6,50000000000000;2,25000000000000;4;0,5000000000000000;12;12;1;11,83333333333333;3,166666667
527;Seit über vier Milliarden Jahren ist der radiale Temperaturverlauf im Erdmantel nur wenig steiler als die Adiabate.;5,76470588235294;2,00000000000000;6;0,4117647058823529;17;15;1;16,42857142857143;3,400000000
528;Dieser Temperaturgradient ist mit etwa 1 K/km viel zu klein, als dass Wärmeleitung einen wesentlichen Beitrag zum Wärmetransport leisten könnte.;6,15000000000000;2,05000000000000;7;0,4000000000000000;20;13;2;15,62500000000000;4,222222222
529;Vielmehr treibt der über die Adiabate hinausgehende Betrag des Temperaturgradienten die Mantelkonvektion an.;7,30769230769231;2,53846153846154;8;0,4615384615384616;13;12;1;17,33333333333333;5,500000000
530;Die im Vergleich zum Erdalter sehr rasche Konvektion – die ozeanische Kruste wurde und wird selten älter als 100 Millionen Jahre – wäre ohne Wärmequellen bald zum Erliegen gekommen.;5,55555555555556;1,96296296296296;4;0,4814814814814815;27;18;3;13,38461538461538;3,466666667
531;Das heißt, dass fühlbare Wärme aus der Zeit der Entstehung der Erde am heutigen Wärmestrom kaum beteiligt ist.;5,05555555555556;1,66666666666667;3;0,4444444444444444;18;19;2;12,50000000000000;4,000000000
532;Der zeitliche Temperaturverlauf war zunächst von der Kinetik des radioaktiven Zerfalls dominiert.;7,08333333333333;2,41666666666667;6;0,5000000000000000;12;12;1;17,50000000000000;3,538461538
533;Kurzlebige Nuklide sorgten für ein Maximum der Manteltemperatur im mittleren Archaikum.;6,90909090909091;2,54545454545455;6;0,6363636363636364;11;10;1;17,00000000000000;2,200000000
534;Seit früher Zeit trägt auch Kristallisationswärme von der Grenze des langsam wachsenden, festen inneren Erdkerns und gravitative Bindungsenergie aus der damit verbundenen Schrumpfung des ganzen Kerns zur Mantelkonvektion bei.;6,72413793103448;2,20689655172414;8;0,5862068965517241;29;28;1;14,11764705882353;4,384615385
535;Heute stammt immer noch der größere Teil der Wärmeleistung aus dem radioaktiven Zerfall der langlebigeren Nuklide im Mantel, 235U und 238U, 232Th und 40K.;5,33333333333333;1,79166666666667;5;0,3750000000000000;24;26;1;14,55555555555556;4,416666667
536;"Der Beitrag jedes Nuklids wird berechnet aus der Zerfallsenergie und der Zerfallsrate; diese wiederum aus der Halbwertszeit und der Konzentration.";6,25000000000000;2,05000000000000;5;0,3500000000000000;20;8;1;16,85714285714286;4,000000000
538;Es ergibt sich eine Leistung aus radioaktivem Zerfall von etwa 20 bis 30 Terawatt oder 40 bis 50 kW/km².;4,25000000000000;1,55000000000000;5;0,3000000000000000;20;19;1;15,50000000000000;3,222222222
539;Der gesamte Erdwärmestrom aus radioaktiven Zerfallsprozessen beträgt etwa 900 EJ pro Jahr.;6,50000000000000;2,25000000000000;5;0,5833333333333334;12;7;1;14,28571428571429;2,400000000
540;Dies entspricht wiederum einer Leistung von etwa 27,5 Terawatt für die gesamte Erde.;5,46153846153846;1,84615384615385;3;0,3846153846153846;13;12;1;12,20000000000000;3,571428571
541;Seit kurzem werden Zerfallsraten mittels Neutrinodetektoren auch direkt gemessen, in Übereinstimmung mit dem bekannten Ergebnis, allerdings noch sehr ungenau, ±40 %.;6,40909090909091;2,13636363636364;6;0,4545454545454546;22;17;1;13,88888888888889;4,000000000
542;Der vertikale Wärmetransport durch Mantelkonvektion endet unter der Erdkruste.;7,66666666666667;2,66666666666667;6;0,5555555555555556;9;6;1;16,60000000000000;4,833333333
543;Von dort wird Wärme zunächst zum größten Teil durch Wärmeleitung transportiert, was einen viel höheren Temperaturgradienten als im Mantel erfordert, in kontinentaler Kruste oft in der Größenordnung von 30 K/km, siehe geothermische Tiefenstufe.;6,27272727272727;2,09090909090909;8;0,4848484848484849;33;27;2;15,00000000000000;4,428571429
544;Zusammen mit der Wärmeleitfähigkeit ergibt sich die lokale Wärmestromdichte und global integriert eine Leistung von etwa 40 Terawatt.;6,38888888888889;2,22222222222222;6;0,4444444444444444;18;14;2;15,37500000000000;3,600000000
545;Das ist nur etwa das Doppelte des Weltenergiebedarfs, was bedeutet, dass Erdwärmenutzung im großen Stil immer auf eine lokale Abkühlung des Gesteins hinausläuft.;5,91304347826087;1,95652173913043;5;0,4347826086956522;23;21;3;14,20000000000000;4,428571429
546;Aufgrund der Wärmekapazität des Gesteins, und der damit verbundenen Menge der gespeicherten Wärme kann aber bei ausreichend großem Volumen die Abkühlung innerhalb der Nutzungsdauer gering bleiben und die Erdwärmenutzung somit nachhaltig sein.;6,53125000000000;2,15625000000000;6;0,4687500000000000;32;27;1;14,86666666666667;5,000000000
547;Der Weltenergiebedarf ist verglichen mit der in der Kruste gespeicherten Wärme klein.;6,08333333333333;1,83333333333333;4;0,5000000000000000;12;12;1;14,00000000000000;3,272727273
548;Diese lokale Abkühlung ihrerseits bewirkt dann eine Vergrößerung des Zuflussbereichs.;7,50000000000000;2,50000000000000;4;0,5000000000000000;10;6;1;15,80000000000000;3,444444444
549;Bei vorhandenen Aquiferen kann das effektiv genutzte Volumen von vornherein größer sein, da hier neben den Temperaturgradienten auch die Druckgradienten eine Rolle spielen.;6,43478260869565;2,26086956521739;8;0,4347826086956522;23;14;2;14,90000000000000;4,500000000
550;Diese finden sich beispielsweise in Grabenbrüchen (in Deutschland der Oberrheingraben) oder in tiefen Sedimentbecken.;7,21428571428571;2,21428571428571;5;0,3571428571428572;14;15;1;15,60000000000000;2,888888889
551;Solche Gebiete sind zunächst Gebieten vorzuziehen, in denen ein dichtes Gestein für die Konvektion erst erschlossen werden muss.;6,05555555555556;2,00000000000000;4;0,3888888888888889;18;14;2;16,00000000000000;4,500000000
553;Im oberflächennahen Grundwasser und in den oberflächennahen Gesteinsschichten wächst mit geringer werdenden Tiefen der Anteil an der Erdwärme, der letztlich aus der Sonneneinstrahlung stammt.;6,91666666666667;2,08333333333333;5;0,5000000000000000;24;17;2;16,00000000000000;4,500000000
555;Die weltweite Stromerzeugung aus Geothermie wird durch die Nutzung von Hochenthalpie-Lagerstätten, die Wärme bei hoher Temperatur liefern, dominiert.;6,73684210526316;2,15789473684211;4;0,5789473684210527;19;22;2;15,63636363636364;3,571428571
556;"Dies sind geologische Wärmeanomalien, die oft mit aktivem Magmatismus einhergehen; dort sind mehrere hundert Grad heiße Fluide (Wasser/Dampf) in einer Tiefe von wenigen hundert Metern anzutreffen.";6,38461538461539;2,23076923076923;6;0,4615384615384616;26;18;3;16,25000000000000;3,444444444
557;Ihr Vorkommen korreliert stark mit aktiven oder ehemals aktiven Vulkanregionen.;6,90000000000000;2,30000000000000;5;0,6000000000000000;10;8;1;14,33333333333333;2,700000000
558;Es gibt aber auch Hochenthalpiefelder, die einen rein plutonitischen oder strukturgeologischen Hintergrund haben.;7,61538461538461;2,38461538461538;6;0,3846153846153846;13;13;2;15,20000000000000;3,500000000
559;Abhängig von den Druck- und Temperaturbedingungen können Hochenthalpie-Lagerstätten mehr dampf- oder mehr wasserdominiert sein.;7,46666666666667;2,33333333333333;8;0,4666666666666667;15;15;1;18,85714285714286;3,181818182
560;Früher wurde der Dampf nach der Nutzung in die Luft entlassen, was zu erheblichem Schwefelgeruch führen konnte (Italien, Larderello).;5,78947368421053;1,94736842105263;4;0,3684210526315789;19;13;2;13,28571428571429;3,400000000
561;Heute werden die abgekühlten Fluide in die Lagerstätte reinjiziert (zurückgepumpt).;7,10000000000000;2,40000000000000;4;0,5000000000000000;10;9;1;19,80000000000000;2,333333333
562;So werden negative Umwelteinwirkungen vermieden und gleichzeitig die Produktivität durch Aufrechterhalten eines höheren Druckniveaus in der Lagerstätte verbessert.;8,05555555555556;2,72222222222222;6;0,5555555555555556;18;14;1;15,20000000000000;4,000000000
563;Das heiße Fluid kann zur Bereitstellung von Industriedampf und zur Speisung von Nah- und Fernwärmenetzen genutzt werden.;6,05882352941176;1,88235294117647;5;0,4705882352941176;17;18;1;17,37500000000000;3,200000000
564;Besonders interessant ist die Erzeugung von Strom aus dem heißen Dampf.;5,45454545454545;1,72727272727273;4;0,4545454545454546;11;10;1;11,80000000000000;2,200000000
565;Hierfür wird das im Untergrund erhitzte Wasser genutzt, um eine Dampfturbine anzutreiben Der geschlossene Kreislauf im Zirkulationssystem steht so unter Druck, dass ein Sieden des eingepressten Wassers verhindert wird und der Dampf erst an der Turbine entsteht (Flash-Verdampfung).;6,10256410256410;1,94871794871795;7;0,5128205128205128;39;38;4;14,65000000000000;4,900000000
566;In nichtvulkanischen Gebieten können die Temperaturen im Untergrund sehr unterschiedlich sein.;7,54545454545455;2,45454545454545;5;0,4545454545454546;11;11;1;14,80000000000000;1,222222222
567;"In der Regel sind jedoch tiefe Bohrungen notwendig; für die Stromerzeugung sind Temperaturen über 80 °C erforderlich.";5,50000000000000;1,94444444444444;5;0,4444444444444444;18;10;2;13,71428571428571;3,400000000
569;"Generell werden im Bereich der tiefen Geothermie drei Arten der Wärmeentnahme aus dem Untergrund unterschieden; welches der in Frage kommenden Verfahren zum Einsatz kommt, ist von den jeweiligen geologischen Voraussetzungen, von der benötigten Energiemenge sowie dem geforderten Temperaturniveau der Wärmenutzung abhängig.";6,78048780487805;2,34146341463415;6;0,5365853658536586;41;29;3;14,22727272727273;4,900000000
